{
  "$schema": "http://json-schema.org/draft-07/schema#",
  "title": "End-to-End Test Definition",
  "description": "Defines a single end-to-end test for the Hardhat test harness.",
  "type": "object",
  "required": [
    "description",
    "repo",
    "packageManager",
    "defaultCommand",
    "tags"
  ],
  "additionalProperties": false,
  "oneOf": [{ "required": ["commit"] }, { "required": ["branch"] }],
  "properties": {
    "$schema": { "type": "string" },
    "description": {
      "type": "string",
      "description": "Short human-readable summary of what this scenario tests"
    },
    "repo": {
      "type": "string",
      "description": "GitHub repo in org/name format (e.g. OpenZeppelin/openzeppelin-contracts)"
    },
    "commit": {
      "type": "string",
      "description": "Full SHA or tag to checkout. Exactly one of \"commit\" or \"branch\" must be specified."
    },
    "branch": {
      "type": "string",
      "description": "Branch to checkout; every init tracks its latest remote tip. Exactly one of \"commit\" or \"branch\" must be specified. Only allowed when the repo is in the NomicFoundation GitHub organization (enforced at runtime, case-insensitively), so that a security breach in an external organization or account cannot automatically affect our end-to-end scenarios."
    },
    "packageManager": {
      "type": "string",
      "enum": ["npm", "bun", "yarn", "pnpm"],
      "description": "Package manager used by the repo"
    },
    "defaultCommand": {
      "type": "string",
      "description": "Default command to run when --command is not provided to exec"
    },
    "workingDirectory": {
      "type": "string",
      "minLength": 1,
      "pattern": "^(?!/)(?!(.*/)?\\.\\.(/|$))",
      "description": "Directory of the Hardhat project, relative to the repo root, for a repo whose project is not at its root (e.g. \"contracts\"). Install, exec and the benchmark commands run there; cloning, submodules and preinstall stay at the repo root. Must stay inside the repo: no absolute path and no \"..\" segment."
    },
    "preinstall": {
      "type": "string",
      "description": "Relative path to a shell script for patching the repo before install. Runs at the repo root."
    },
    "install": {
      "type": "string",
      "description": "Relative path to a custom install script (overrides built-in Verdaccio flow)"
    },
    "tags": {
      "type": "array",
      "items": { "type": "string" },
      "minItems": 1,
      "description": "Tags for filtering (e.g. [\"solidity-compile\", \"solidity-test\"])"
    },
    "env": {
      "type": "object",
      "additionalProperties": { "type": "string" },
      "description": "Environment variables to set during install/exec. Values may reference host variables with the devcontainer-style token ${localEnv:NAME} (e.g. \"FOUNDRY_RPC_URL\": \"${localEnv:ALCHEMY_URL}\"); the referenced host variable must be set or the run will fail."
    },
    "submodules": {
      "type": "boolean",
      "description": "Initialize git submodules recursively (default: false)"
    },
    "disabled": {
      "type": "boolean",
      "const": true,
      "description": "Set to true to skip this scenario during end-to-end runs"
    },
    "benchmark": {
      "type": "object",
      "additionalProperties": false,
      "anyOf": [{ "required": ["skip"] }, { "required": ["commands"] }],
      "properties": {
        "skip": {
          "type": "boolean",
          "const": true,
          "description": "Set to true to skip this scenario in the regression benchmark"
        },
        "commands": {
          "type": "object",
          "minProperties": 1,
          "propertyNames": {
            "type": "string",
            "minLength": 1,
            "pattern": "^(?!\\d+$).+"
          },
          "additionalProperties": {
            "type": "object",
            "oneOf": [
              {
                "additionalProperties": false,
                "required": ["runs", "command"],
                "properties": {
                  "runs": {
                    "type": "integer",
                    "minimum": 1,
                    "description": "Number of measured runs for this command"
                  },
                  "statistic": {
                    "description": "Statistic of the measured runs tracked for wall-clock time, CPU time and peak RSS (default \"mean\"), for all three or per metric. Use \"median\" when runs can stall on something outside the code under test, e.g. a remote RPC round trip",
                    "oneOf": [
                      { "type": "string", "enum": ["mean", "median"] },
                      {
                        "type": "object",
                        "additionalProperties": false,
                        "properties": {
                          "wall": {
                            "type": "string",
                            "enum": ["mean", "median"]
                          },
                          "cpu": {
                            "type": "string",
                            "enum": ["mean", "median"]
                          },
                          "peakRss": {
                            "type": "string",
                            "enum": ["mean", "median"]
                          }
                        }
                      }
                    ]
                  },
                  "warmup": {
                    "type": "integer",
                    "minimum": 0,
                    "description": "Optional number of unmeasured runs before the measured ones (default 0), e.g. to fill an on-disk RPC cache"
                  },
                  "prepare": {
                    "type": "string",
                    "minLength": 1,
                    "description": "Optional shell snippet to run, unmeasured, before each timed run"
                  },
                  "command": {
                    "type": "string",
                    "minLength": 1,
                    "description": "Shell command to benchmark"
                  },
                  "dependsOn": {
                    "type": "array",
                    "items": { "type": "string", "minLength": 1 },
                    "minItems": 1,
                    "description": "Names of other entries (command or step names in this scenario) that must run before this one for its measurement to be valid. Used by bench:regression's --benchmarks filter to run prerequisites and skip unrelated work."
                  }
                }
              },
              {
                "additionalProperties": false,
                "required": ["runs", "steps"],
                "properties": {
                  "runs": {
                    "type": "integer",
                    "minimum": 1,
                    "description": "Number of times to run the whole step sequence"
                  },
                  "steps": {
                    "type": "object",
                    "minProperties": 1,
                    "propertyNames": {
                      "type": "string",
                      "minLength": 1,
                      "pattern": "^(?!\\d+$).+"
                    },
                    "additionalProperties": {
                      "type": "object",
                      "additionalProperties": false,
                      "required": ["command"],
                      "properties": {
                        "command": {
                          "type": "string",
                          "minLength": 1,
                          "description": "Shell command for this step"
                        },
                        "measure": {
                          "type": "boolean",
                          "description": "Emit a benchmark entry for this step (default true)"
                        },
                        "dependsOn": {
                          "type": "array",
                          "items": { "type": "string", "minLength": 1 },
                          "minItems": 1,
                          "description": "Names of other entries (step names in this sequence, or command names) that must run before this step for its measurement to be valid. Used by bench:regression's --benchmarks filter to run prerequisites and skip unrelated work."
                        }
                      }
                    },
                    "description": "Ordered steps run as a sequence, repeated `runs` times. Each step is timed individually in-process; the key becomes the benchmark name on disk for measured steps."
                  }
                }
              }
            ]
          },
          "description": "Named commands to benchmark. Iterated in definition order; the key becomes the benchmark name on disk. Each entry is either a single command or a step sequence."
        }
      },
      "description": "Benchmark configuration for pnpm bench and pnpm bench:regression"
    }
  }
}
