{
  "$schema": "../../scripts/end-to-end/schema/scenario.schema.json",
  "description": "1inch Aqua Protocol fork to Hardhat 3.",
  "tags": ["external-repo"],
  "repo": "anaPerezGhiglia/aqua",
  "commit": "19277969b5e67b5b55968422b4cba4029544807c",
  "packageManager": "yarn",
  "submodules": false,
  "defaultCommand": "npx hardhat test solidity",
  "benchmark": {
    "commands": {
      "compile sequence": {
        "runs": 2,
        "steps": {
          "reset files & cache": {
            "command": "git checkout -- test/AquaLifecycle.t.sol test/AquaStorageTest.t.sol src/Aqua.sol && npx hardhat clean",
            "measure": false
          },
          "cold compile": {
            "command": "npx hardhat compile",
            "dependsOn": ["reset files & cache"]
          },
          "edit & compile Solidity test with min deps: test/AquaLifecycle.t.sol": {
            "command": "printf \"\\n// hardhat benchmark edit\\n\" >> test/AquaLifecycle.t.sol && npx hardhat compile",
            "dependsOn": ["cold compile"]
          },
          "edit & compile Solidity test with max deps: test/AquaStorageTest.t.sol": {
            "command": "printf \"\\n// hardhat benchmark edit\\n\" >> test/AquaStorageTest.t.sol && npx hardhat compile",
            "dependsOn": ["cold compile"]
          },
          "edit & compile Solidity contract: src/Aqua.sol": {
            "command": "printf \"\\n// hardhat benchmark edit\\n\" >> src/Aqua.sol && npx hardhat compile",
            "dependsOn": ["cold compile"]
          }
        }
      },
      "warm compile": {
        "runs": 2,
        "command": "npx hardhat compile",
        "dependsOn": ["cold compile"]
      },
      "test solidity": {
        "runs": 5,
        "command": "npx hardhat test solidity --no-compile",
        "dependsOn": ["cold compile"]
      },
      "test solidity -vvv": {
        "runs": 5,
        "command": "npx hardhat test solidity --no-compile -vvv",
        "dependsOn": ["cold compile"]
      },
      "test solidity -vvvv": {
        "runs": 5,
        "command": "npx hardhat test solidity --no-compile -vvvv",
        "dependsOn": ["cold compile"]
      }
    }
  }
}
