{
  "$schema": "../../scripts/end-to-end/schema/scenario.schema.json",
  "description": "Uniswap V4 core contracts fork to Hardhat 3.",
  "tags": ["external-repo"],
  "repo": "anaPerezGhiglia/uniswap-v4-core",
  "commit": "ab2b22eef19e0abe29d67420dde81b5d54455ae5",
  "packageManager": "pnpm",
  "env": {
    "pnpm_config_dangerously_allow_all_builds": "true"
  },
  "submodules": true,
  "defaultCommand": "npx hardhat test solidity",
  "benchmark": {
    "commands": {
      "compile sequence": {
        "runs": 3,
        "steps": {
          "reset files & cache": {
            "command": "git checkout -- test/libraries/BitMath.t.sol test/PoolManager.t.sol src/types/Currency.sol && npx hardhat clean",
            "measure": false
          },
          "cold compile": {
            "command": "npx hardhat compile",
            "dependsOn": ["reset files & cache"]
          },
          "edit & compile Solidity test with min deps: test/libraries/BitMath.t.sol": {
            "command": "printf \"\\n// hardhat benchmark edit\\n\" >> test/libraries/BitMath.t.sol && npx hardhat compile",
            "dependsOn": ["cold compile"]
          },
          "edit & compile Solidity test with max deps: test/PoolManager.t.sol": {
            "command": "printf \"\\n// hardhat benchmark edit\\n\" >> test/PoolManager.t.sol && npx hardhat compile",
            "dependsOn": ["cold compile"]
          },
          "edit & compile Solidity contract: src/types/Currency.sol": {
            "command": "printf \"\\n// hardhat benchmark edit\\n\" >> src/types/Currency.sol && npx hardhat compile",
            "dependsOn": ["cold compile"]
          }
        }
      },
      "warm compile": {
        "runs": 15,
        "command": "npx hardhat compile",
        "dependsOn": ["cold compile"]
      },
      "test solidity": {
        "runs": 9,
        "command": "npx hardhat test solidity --no-compile",
        "dependsOn": ["cold compile"]
      },
      "test solidity -vvv": {
        "runs": 9,
        "command": "npx hardhat test solidity --no-compile -vvv",
        "dependsOn": ["cold compile"]
      },
      "test solidity -vvvv": {
        "runs": 9,
        "command": "npx hardhat test solidity --no-compile -vvvv",
        "dependsOn": ["cold compile"]
      }
    }
  }
}
