{
  "$schema": "../../scripts/end-to-end/schema/scenario.schema.json",
  "description": "1inch SwapVM fork compiled at solc 0.8.34 — a genuinely via-IR-forced repo (upstream ships via-IR + custom Yul optimizerSteps only). Legacy compiles are impossible for both compilers: solc is stack-too-deep, and solx's LLVM stackification rejects the recursive SwapVM runLoop. solx 0.1.4 (the shipped map when this scenario was written) hits a YulException on via-IR that 0.1.7 fixes; the version-pinned solx-0.1.8 cell is the shipped measurement now that the plugin maps 0.8.34 to 0.1.8. The repo's @1inch npm deps pin pragma 0.8.30 exactly; the 'relax dependency pragmas' prime step relaxes them post-install (preinstall covers the repo's own sources). Warm-compile (no-op) cells exist for solc and forge; solx has none because it cannot compile the repo at all. Warm test cells run the Foundry suite under solc, slang and forge; preinstall takes one TWAP test out of discovery for all of them, because its expected amounts depend on solc via-IR re-reading block.timestamp after vm.warp. forge + solar has no test cell: one 1000-round fee-tracking test exceeds forge's per-test gas limit under solar.",
  "tags": ["external-repo", "solx"],
  "repo": "anaPerezGhiglia/1inch-swap-vm",
  "commit": "7102f412db16aaf10dafa8dd40c4b85f99f0bb4e",
  "packageManager": "pnpm",
  "env": {
    "pnpm_config_block_exotic_subdeps": "false",
    "pnpm_config_dangerously_allow_all_builds": "true",
    "pnpm_config_frozen_lockfile": "false"
  },
  "submodules": false,
  "preinstall": "./preinstall.sh",
  "defaultCommand": "npx hardhat compile --build-profile solx-0.1.8-via-ir",
  "benchmark": {
    "commands": {
      "prime compilers": {
        "runs": 1,
        "steps": {
          "relax dependency pragmas": {
            "command": "node ./relax-dep-pragmas.cjs",
            "measure": false
          },
          "assert fresh hardhat-slang-solx": {
            "command": "diff -rq .solx/expected-dist-src node_modules/@nomicfoundation/hardhat-slang-solx/dist/src",
            "measure": false
          },
          "assert fresh hardhat-slang": {
            "command": "diff -rq .solx/expected-slang-dist-src node_modules/@nomicfoundation/hardhat-slang/dist/src",
            "measure": false
          },
          "download solc and warm caches": {
            "command": "npx hardhat compile --build-profile solc-via-ir && npx hardhat clean",
            "measure": false
          },
          "warm forge solc cache": {
            "command": "FOUNDRY_SOLC=0.8.34 FOUNDRY_EVM_VERSION=cancun ./.foundry/forge build --skip 'script/**' && ./.foundry/forge clean",
            "measure": false
          },
          "warm forge solar": {
            "command": "FOUNDRY_SOLC=./.foundry-solar/solar FOUNDRY_LINT_LINT_ON_BUILD=false FOUNDRY_EVM_VERSION=cancun ./.foundry-solar/forge build --skip 'script/**' --offline && ./.foundry-solar/forge clean",
            "measure": false
          }
        }
      },
      "cold compile solc via-ir": {
        "runs": 5,
        "dependsOn": [
          "relax dependency pragmas",
          "assert fresh hardhat-slang-solx",
          "download solc and warm caches"
        ],
        "prepare": "npx hardhat clean",
        "command": "npx hardhat compile --build-profile solc-via-ir"
      },
      "cold compile slang": {
        "runs": 5,
        "dependsOn": [
          "relax dependency pragmas",
          "assert fresh hardhat-slang-solx",
          "assert fresh hardhat-slang",
          "download solc and warm caches"
        ],
        "prepare": "npx hardhat clean",
        "command": "npx hardhat compile --build-profile slang"
      },
      "cold compile forge-1.7.1 via-ir": {
        "runs": 5,
        "dependsOn": ["relax dependency pragmas", "warm forge solc cache"],
        "prepare": "./.foundry/forge clean",
        "command": "FOUNDRY_SOLC=0.8.34 FOUNDRY_EVM_VERSION=cancun ./.foundry/forge build --skip 'script/**' --offline"
      },
      "cold compile forge-1.8.5 solar": {
        "runs": 5,
        "dependsOn": ["relax dependency pragmas", "warm forge solar"],
        "prepare": "./.foundry-solar/forge clean",
        "command": "FOUNDRY_SOLC=./.foundry-solar/solar FOUNDRY_LINT_LINT_ON_BUILD=false FOUNDRY_EVM_VERSION=cancun ./.foundry-solar/forge build --skip 'script/**' --offline"
      },
      "warm compile solc via-ir": {
        "runs": 3,
        "dependsOn": [
          "relax dependency pragmas",
          "assert fresh hardhat-slang-solx",
          "download solc and warm caches"
        ],
        "prepare": "npx hardhat compile --build-profile solc-via-ir",
        "command": "npx hardhat compile --build-profile solc-via-ir"
      },
      "warm compile forge-1.7.1 via-ir": {
        "runs": 3,
        "dependsOn": ["relax dependency pragmas", "warm forge solc cache"],
        "prepare": "FOUNDRY_SOLC=0.8.34 FOUNDRY_EVM_VERSION=cancun ./.foundry/forge build --skip 'script/**' --offline",
        "command": "FOUNDRY_SOLC=0.8.34 FOUNDRY_EVM_VERSION=cancun ./.foundry/forge build --skip 'script/**' --offline"
      },
      "warm test solc via-ir": {
        "runs": 3,
        "dependsOn": [
          "relax dependency pragmas",
          "assert fresh hardhat-slang-solx",
          "download solc and warm caches"
        ],
        "prepare": "npx hardhat compile --build-profile solc-via-ir",
        "command": "npx hardhat test solidity --build-profile solc-via-ir"
      },
      "warm test slang": {
        "runs": 3,
        "dependsOn": [
          "relax dependency pragmas",
          "assert fresh hardhat-slang-solx",
          "assert fresh hardhat-slang",
          "download solc and warm caches"
        ],
        "prepare": "npx hardhat compile --build-profile slang",
        "command": "npx hardhat test solidity --build-profile slang"
      },
      "warm test forge-1.7.1 via-ir": {
        "runs": 3,
        "dependsOn": ["relax dependency pragmas", "warm forge solc cache"],
        "prepare": "FOUNDRY_SOLC=0.8.34 FOUNDRY_EVM_VERSION=cancun ./.foundry/forge build --skip 'script/**' --offline",
        "command": "FOUNDRY_SOLC=0.8.34 FOUNDRY_EVM_VERSION=cancun FOUNDRY_FUZZ_SEED=0x736f6c782d746573742d657865637574696f6e2d6576616c756174696f6e2e31 ./.foundry/forge test --skip 'script/**' --offline"
      }
    }
  }
}
