{
  "$schema": "../../scripts/end-to-end/schema/scenario.schema.json",
  "description": "Lido core contracts Hardhat 3 migration branch (NomicFoundation/lidofinance-core PR #1) including their Mocha test suite.",
  "tags": ["external-repo", "mocha"],
  "repo": "NomicFoundation/lidofinance-core",
  "commit": "3d690c270cde8f0509e2a20d6ae659ef76e094e0",
  "packageManager": "yarn",
  "submodules": false,
  "preinstall": "./preinstall.sh",
  "env": {
    "LOCAL_DEVNET_PK": "0x0000000000000000000000000000000000000000000000000000000000000001"
  },
  "defaultCommand": "yarn run test",
  "benchmark": {
    "commands": {
      "compile sequence": {
        "runs": 2,
        "steps": {
          "reset files & cache": {
            "command": "git checkout -- test/common/math256.t.sol test/common/lib/BLS.t.sol contracts/common/lib/Math256.sol && npx hardhat clean",
            "measure": false
          },
          "cold compile": {
            "command": "npx hardhat compile",
            "dependsOn": ["reset files & cache"]
          },
          "edit & compile Solidity test with min deps: test/common/math256.t.sol": {
            "command": "printf \"\\n// hardhat benchmark edit\\n\" >> test/common/math256.t.sol && npx hardhat compile",
            "dependsOn": ["cold compile"]
          },
          "edit & compile Solidity test with max deps: test/common/lib/BLS.t.sol": {
            "command": "printf \"\\n// hardhat benchmark edit\\n\" >> test/common/lib/BLS.t.sol && npx hardhat compile",
            "dependsOn": ["cold compile"]
          },
          "edit & compile Solidity contract: contracts/common/lib/Math256.sol": {
            "command": "printf \"\\n// hardhat benchmark edit\\n\" >> contracts/common/lib/Math256.sol && npx hardhat compile",
            "dependsOn": ["cold compile"]
          }
        }
      },
      "warm compile": {
        "runs": 2,
        "command": "npx hardhat compile",
        "dependsOn": ["cold compile"]
      },
      "test mocha": {
        "runs": 2,
        "command": "yarn run test --no-compile",
        "dependsOn": ["cold compile"]
      },
      "test mocha -vvv": {
        "runs": 2,
        "command": "yarn run test --no-compile -vvv",
        "dependsOn": ["cold compile"]
      },
      "test mocha -vvvv": {
        "runs": 3,
        "command": "yarn run test --no-compile -vvvv",
        "dependsOn": ["cold compile"]
      }
    }
  }
}
