{
  "$schema": "../../scripts/end-to-end/schema/scenario.schema.json",
  "description": "Solady (assembly-heavy, solx's hardest case) compiled at solc 0.8.34, benchmarking solx against solc and forge. Mirrors upstream's post_osaka CI profile: the default profile targets paris + skip globs (inexpressible in Hardhat; paris predates solx's EVM floor), and preinstall removes the profile's five ext/ithaca skips for exact scope parity (246 sources on both tools). No solc no-opt cell: test/RedBlackTree.t.sol is stack-too-deep under optimizer-off legacy solc, and upstream only ships optimizer-on — the failure is the datum. Preinstall renames BlockHashLibTest#testBlockHash out of test discovery, identically for all three toolchains (2040 tests run everywhere). Root cause: Hardhat's Solidity-test genesis installs a revert stub at the EIP-2935 history-storage address (\"EIP2935 is not supported in Hardhat yet\", hardhat#6226) where forge leaves it empty, so the test's non-etched path reverts under BOTH compilers — a Hardhat feature gap, not a fuzz input and not a compiler divergence. Left in, it cost the solx cells ~7s: EDR builds its solx stack-trace decoder (a full DWARF decode) once on a run's first failure, and a vm.skip'd test still triggers it, so only removing the test from discovery reclaims the exit code and the time (see /workspace/hardhat-solx-footnote-research.md). The via-IR forge cells (FOUNDRY_VIA_IR=true on the same profile, everything else identical) mirror the hardhat solc-via-ir profile, so forge is measured in both pipelines like hardhat is — upstream ships legacy, so the legacy forge cells remain the ones that describe upstream's own build.",
  "tags": ["external-repo", "solx"],
  "repo": "nebasuke/solady",
  "commit": "13d87ff27de01eb671dbee41b6d84ef98d5e2c32",
  "packageManager": "npm",
  "preinstall": "./preinstall.sh",
  "defaultCommand": "npx hardhat compile --build-profile solx",
  "benchmark": {
    "commands": {
      "prime compilers": {
        "runs": 1,
        "steps": {
          "assert fresh hardhat-slang-solx": {
            "command": "diff -rq .solx/expected-dist-src node_modules/@nomicfoundation/hardhat-slang-solx/dist/src",
            "measure": false
          },
          "assert fresh hardhat-slang": {
            "command": "diff -rq .solx/expected-slang-dist-src node_modules/@nomicfoundation/hardhat-slang/dist/src",
            "measure": false
          },
          "download solc + solx and warm caches": {
            "command": "npx hardhat compile && npx hardhat compile --build-profile solx && npx hardhat clean",
            "measure": false
          },
          "warm forge solc cache": {
            "command": "FOUNDRY_PROFILE=post_osaka FOUNDRY_SOLC=0.8.34 ./.foundry/forge build && ./.foundry/forge clean",
            "measure": false
          },
          "warm forge solar": {
            "command": "FOUNDRY_SOLC=./.foundry-solar/solar FOUNDRY_LINT_LINT_ON_BUILD=false FOUNDRY_PROFILE=post_osaka ./.foundry-solar/forge build --offline && ./.foundry-solar/forge clean",
            "measure": false
          }
        }
      },
      "cold compile solc": {
        "runs": 5,
        "dependsOn": [
          "assert fresh hardhat-slang-solx",
          "download solc + solx and warm caches"
        ],
        "prepare": "npx hardhat clean",
        "command": "npx hardhat compile"
      },
      "cold compile solc via-ir": {
        "runs": 5,
        "dependsOn": [
          "assert fresh hardhat-slang-solx",
          "download solc + solx and warm caches"
        ],
        "prepare": "npx hardhat clean",
        "command": "npx hardhat compile --build-profile solc-via-ir"
      },
      "cold compile solx-0.1.8": {
        "runs": 5,
        "dependsOn": [
          "assert fresh hardhat-slang-solx",
          "download solc + solx and warm caches"
        ],
        "prepare": "npx hardhat clean",
        "command": "npx hardhat compile --build-profile solx-0.1.8"
      },
      "cold compile slang": {
        "runs": 5,
        "dependsOn": [
          "assert fresh hardhat-slang-solx",
          "assert fresh hardhat-slang",
          "download solc + solx and warm caches"
        ],
        "prepare": "npx hardhat clean",
        "command": "npx hardhat compile --build-profile slang"
      },
      "cold compile solx-0.1.8 via-ir": {
        "runs": 5,
        "dependsOn": [
          "assert fresh hardhat-slang-solx",
          "download solc + solx and warm caches"
        ],
        "prepare": "npx hardhat clean",
        "command": "npx hardhat compile --build-profile solx-0.1.8-via-ir"
      },
      "cold compile forge-1.7.1": {
        "runs": 5,
        "dependsOn": ["warm forge solc cache"],
        "prepare": "./.foundry/forge clean",
        "command": "FOUNDRY_PROFILE=post_osaka FOUNDRY_SOLC=0.8.34 ./.foundry/forge build --offline"
      },
      "warm test solx-0.1.8": {
        "runs": 3,
        "dependsOn": [
          "assert fresh hardhat-slang-solx",
          "download solc + solx and warm caches"
        ],
        "prepare": "npx hardhat compile --build-profile solx-0.1.8",
        "command": "npx hardhat test solidity --build-profile solx-0.1.8"
      },
      "warm test slang": {
        "runs": 3,
        "dependsOn": [
          "assert fresh hardhat-slang-solx",
          "assert fresh hardhat-slang",
          "download solc + solx and warm caches"
        ],
        "prepare": "npx hardhat compile --build-profile slang",
        "command": "npx hardhat test solidity --build-profile slang"
      },
      "warm test solx-0.1.8 via-ir": {
        "runs": 3,
        "dependsOn": [
          "assert fresh hardhat-slang-solx",
          "download solc + solx and warm caches"
        ],
        "prepare": "npx hardhat compile --build-profile solx-0.1.8-via-ir",
        "command": "npx hardhat test solidity --build-profile solx-0.1.8-via-ir"
      },
      "warm test solc": {
        "runs": 3,
        "dependsOn": [
          "assert fresh hardhat-slang-solx",
          "download solc + solx and warm caches"
        ],
        "prepare": "npx hardhat compile",
        "command": "npx hardhat test solidity"
      },
      "warm test solc via-ir": {
        "runs": 3,
        "dependsOn": [
          "assert fresh hardhat-slang-solx",
          "download solc + solx and warm caches"
        ],
        "prepare": "npx hardhat compile --build-profile solc-via-ir",
        "command": "npx hardhat test solidity --build-profile solc-via-ir"
      },
      "warm test forge-1.7.1": {
        "runs": 3,
        "dependsOn": ["warm forge solc cache"],
        "prepare": "FOUNDRY_PROFILE=post_osaka FOUNDRY_SOLC=0.8.34 ./.foundry/forge build --offline",
        "command": "FOUNDRY_PROFILE=post_osaka FOUNDRY_SOLC=0.8.34 FOUNDRY_FUZZ_SEED=0x736f6c782d746573742d657865637574696f6e2d6576616c756174696f6e2e31 ./.foundry/forge test --offline"
      },
      "warm compile solc": {
        "runs": 3,
        "dependsOn": [
          "assert fresh hardhat-slang-solx",
          "download solc + solx and warm caches"
        ],
        "prepare": "npx hardhat compile",
        "command": "npx hardhat compile"
      },
      "warm compile solx-0.1.8": {
        "runs": 3,
        "dependsOn": [
          "assert fresh hardhat-slang-solx",
          "download solc + solx and warm caches"
        ],
        "prepare": "npx hardhat compile --build-profile solx-0.1.8",
        "command": "npx hardhat compile --build-profile solx-0.1.8"
      },
      "warm compile forge-1.7.1": {
        "runs": 3,
        "dependsOn": ["warm forge solc cache"],
        "prepare": "FOUNDRY_PROFILE=post_osaka FOUNDRY_SOLC=0.8.34 ./.foundry/forge build --offline",
        "command": "FOUNDRY_PROFILE=post_osaka FOUNDRY_SOLC=0.8.34 ./.foundry/forge build --offline"
      },
      "cold compile forge-1.7.1 via-ir": {
        "runs": 5,
        "dependsOn": ["warm forge solc cache"],
        "prepare": "./.foundry/forge clean",
        "command": "FOUNDRY_VIA_IR=true FOUNDRY_PROFILE=post_osaka FOUNDRY_SOLC=0.8.34 ./.foundry/forge build --offline"
      },
      "cold compile forge-1.8.5 solar": {
        "runs": 5,
        "dependsOn": ["warm forge solar"],
        "prepare": "./.foundry-solar/forge clean",
        "command": "FOUNDRY_SOLC=./.foundry-solar/solar FOUNDRY_LINT_LINT_ON_BUILD=false FOUNDRY_PROFILE=post_osaka ./.foundry-solar/forge build --offline"
      },
      "warm compile forge-1.7.1 via-ir": {
        "runs": 3,
        "dependsOn": ["warm forge solc cache"],
        "prepare": "FOUNDRY_VIA_IR=true FOUNDRY_PROFILE=post_osaka FOUNDRY_SOLC=0.8.34 ./.foundry/forge build --offline",
        "command": "FOUNDRY_VIA_IR=true FOUNDRY_PROFILE=post_osaka FOUNDRY_SOLC=0.8.34 ./.foundry/forge build --offline"
      },
      "warm test forge-1.7.1 via-ir": {
        "runs": 3,
        "dependsOn": ["warm forge solc cache"],
        "prepare": "FOUNDRY_VIA_IR=true FOUNDRY_PROFILE=post_osaka FOUNDRY_SOLC=0.8.34 ./.foundry/forge build --offline",
        "command": "FOUNDRY_VIA_IR=true FOUNDRY_PROFILE=post_osaka FOUNDRY_SOLC=0.8.34 FOUNDRY_FUZZ_SEED=0x736f6c782d746573742d657865637574696f6e2d6576616c756174696f6e2e31 ./.foundry/forge test --offline"
      }
    }
  }
}
