{
  "$schema": "../../scripts/end-to-end/schema/scenario.schema.json",
  "description": "UniswapX contracts fork to Hardhat 3.",
  "tags": ["external-repo"],
  "repo": "popescuoctavian/UniswapX",
  "commit": "e4ed16b4e6894d36b7a19b985333dc254ebbf9d2",
  "packageManager": "npm",
  "submodules": true,
  "env": {
    "FOUNDRY_RPC_URL": "${localEnv:ALCHEMY_URL}"
  },
  "defaultCommand": "npx hardhat test solidity",
  "benchmark": {
    "commands": {
      "compile sequence": {
        "runs": 2,
        "steps": {
          "reset files & cache": {
            "command": "git checkout -- test/lib/CosignerLib.t.sol test/reactors/V3DutchOrderReactor.t.sol src/base/ReactorStructs.sol && npx hardhat clean",
            "measure": false
          },
          "cold compile": {
            "command": "npx hardhat compile",
            "dependsOn": ["reset files & cache"]
          },
          "edit & compile Solidity test with min deps: test/lib/CosignerLib.t.sol": {
            "command": "printf \"\\n// hardhat benchmark edit\\n\" >> test/lib/CosignerLib.t.sol && npx hardhat compile",
            "dependsOn": ["cold compile"]
          },
          "edit & compile Solidity test with max deps: test/reactors/V3DutchOrderReactor.t.sol": {
            "command": "printf \"\\n// hardhat benchmark edit\\n\" >> test/reactors/V3DutchOrderReactor.t.sol && npx hardhat compile",
            "dependsOn": ["cold compile"]
          },
          "edit & compile Solidity contract: src/base/ReactorStructs.sol": {
            "command": "printf \"\\n// hardhat benchmark edit\\n\" >> src/base/ReactorStructs.sol && npx hardhat compile",
            "dependsOn": ["cold compile"]
          }
        }
      },
      "warm compile": {
        "runs": 2,
        "command": "npx hardhat compile",
        "dependsOn": ["cold compile"]
      },
      "test solidity": {
        "runs": 2,
        "warmup": 1,
        "command": "npx hardhat test solidity --no-compile",
        "dependsOn": ["cold compile"]
      },
      "test solidity -vvv": {
        "runs": 2,
        "command": "npx hardhat test solidity --no-compile -vvv",
        "dependsOn": ["cold compile", "test solidity"]
      },
      "test solidity -vvvv": {
        "runs": 2,
        "command": "npx hardhat test solidity --no-compile -vvvv",
        "dependsOn": ["cold compile", "test solidity"]
      }
    }
  }
}
