{
  "$schema": "../../scripts/end-to-end/schema/scenario.schema.json",
  "description": "1inch SwapVM contract fork to Hardhat 3.",
  "tags": ["external-repo"],
  "repo": "anaPerezGhiglia/1inch-swap-vm",
  "commit": "7102f412db16aaf10dafa8dd40c4b85f99f0bb4e",
  "packageManager": "pnpm",
  "env": {
    "pnpm_config_block_exotic_subdeps": "false",
    "pnpm_config_dangerously_allow_all_builds": "true"
  },
  "submodules": false,
  "defaultCommand": "npx hardhat test solidity",
  "benchmark": {
    "commands": {
      "compile sequence": {
        "runs": 3,
        "steps": {
          "reset files & cache": {
            "command": "git checkout -- test/ProtocolFeeProviderMock.t.sol test/TransferModesCombinations.t.sol src/SwapVM.sol && npx hardhat clean",
            "measure": false
          },
          "cold compile": {
            "command": "npx hardhat compile",
            "dependsOn": ["reset files & cache"]
          },
          "edit & compile Solidity test with min deps: test/ProtocolFeeProviderMock.t.sol": {
            "command": "printf \"\\n// hardhat benchmark edit\\n\" >> test/ProtocolFeeProviderMock.t.sol && npx hardhat compile",
            "dependsOn": ["cold compile"]
          },
          "edit & compile Solidity test with max deps: test/TransferModesCombinations.t.sol": {
            "command": "printf \"\\n// hardhat benchmark edit\\n\" >> test/TransferModesCombinations.t.sol && npx hardhat compile",
            "dependsOn": ["cold compile"]
          },
          "edit & compile Solidity contract: src/SwapVM.sol": {
            "command": "printf \"\\n// hardhat benchmark edit\\n\" >> src/SwapVM.sol && npx hardhat compile",
            "dependsOn": ["cold compile"]
          }
        }
      },
      "warm compile": {
        "runs": 5,
        "command": "npx hardhat compile",
        "dependsOn": ["cold compile"]
      },
      "test solidity": {
        "runs": 15,
        "command": "npx hardhat test solidity --no-compile",
        "dependsOn": ["cold compile"]
      },
      "test solidity -vvv": {
        "runs": 4,
        "command": "npx hardhat test solidity --no-compile -vvv",
        "dependsOn": ["cold compile"]
      },
      "test solidity -vvvv": {
        "runs": 4,
        "command": "npx hardhat test solidity --no-compile -vvvv",
        "dependsOn": ["cold compile"]
      }
    }
  }
}
