{
  "$schema": "../../scripts/end-to-end/schema/scenario.schema.json",
  "description": "ENS contracts v1.7.0 (vitest test suite)",
  "tags": ["external-repo"],
  "repo": "ensdomains/ens-contracts",
  "commit": "9b034936a42f462fc04bc0a929a419ede5e18d59",
  "packageManager": "bun",
  "preinstall": "./preinstall.sh",
  "defaultCommand": "bun run test",
  "benchmark": {
    "commands": {
      "compile sequence": {
        "runs": 2,
        "steps": {
          "reset files & cache": {
            "command": "git checkout -- contracts/dnssec-oracle/SHA1.sol contracts/resolvers/PublicResolver.sol contracts/utils/LibMem/LibMem.sol && npx hardhat clean",
            "measure": false
          },
          "cold compile": {
            "command": "npx hardhat compile",
            "dependsOn": ["reset files & cache"]
          },
          "edit & compile Solidity contract with min deps: contracts/dnssec-oracle/SHA1.sol": {
            "command": "printf \"\\n// hardhat benchmark edit\\n\" >> contracts/dnssec-oracle/SHA1.sol && npx hardhat compile",
            "dependsOn": ["cold compile"]
          },
          "edit & compile Solidity contract with max deps: contracts/resolvers/PublicResolver.sol": {
            "command": "printf \"\\n// hardhat benchmark edit\\n\" >> contracts/resolvers/PublicResolver.sol && npx hardhat compile",
            "dependsOn": ["cold compile"]
          },
          "edit & compile Solidity contract with max deps: contracts/utils/LibMem/LibMem.sol": {
            "command": "printf \"\\n// hardhat benchmark edit\\n\" >> contracts/utils/LibMem/LibMem.sol && npx hardhat compile",
            "dependsOn": ["cold compile"]
          }
        }
      },
      "warm compile": {
        "runs": 2,
        "command": "npx hardhat compile",
        "dependsOn": ["cold compile"]
      },
      "test vitest": {
        "runs": 2,
        "command": "NODE_OPTIONS=\"--disable-warning=ExperimentalWarning\" bunx vitest run",
        "dependsOn": ["cold compile"]
      },
      "test vitest -vvv": {
        "runs": 2,
        "command": "HARDHAT_VERBOSITY=3 NODE_OPTIONS=\"--disable-warning=ExperimentalWarning\" bunx vitest run",
        "dependsOn": ["cold compile"]
      },
      "test vitest -vvvv": {
        "runs": 2,
        "command": "HARDHAT_VERBOSITY=4 NODE_OPTIONS=\"--disable-warning=ExperimentalWarning\" bunx vitest run",
        "dependsOn": ["cold compile"]
      }
    }
  }
}
