{
  "$schema": "../../scripts/end-to-end/schema/scenario.schema.json",
  "description": "OpenZeppelin's Hardhat 3 migration (PR #6542, merged) including their Mocha test suite.",
  "tags": ["external-repo", "mocha"],
  "repo": "OpenZeppelin/openzeppelin-contracts",
  "commit": "cebdf7bf38f6bd8c3bd83beb1395bd069e3c04c9",
  "packageManager": "npm",
  "submodules": true,
  "preinstall": "./preinstall.sh",
  "defaultCommand": "npx hardhat test mocha",
  "benchmark": {
    "commands": {
      "compile sequence": {
        "runs": 2,
        "steps": {
          "reset files & cache": {
            "command": "git checkout -- test/utils/Base58.t.sol test/governance/extensions/GovernorSuperQuorumGreaterThanQuorum.t.sol contracts/utils/math/Math.sol && npx hardhat clean",
            "measure": false
          },
          "cold compile": {
            "command": "npx hardhat compile",
            "dependsOn": ["reset files & cache"]
          },
          "edit & compile Solidity test with min deps: test/utils/Base58.t.sol": {
            "command": "printf \"\\n// hardhat benchmark edit\\n\" >> test/utils/Base58.t.sol && npx hardhat compile",
            "dependsOn": ["cold compile"]
          },
          "edit & compile Solidity test with max deps: test/governance/extensions/GovernorSuperQuorumGreaterThanQuorum.t.sol": {
            "command": "printf \"\\n// hardhat benchmark edit\\n\" >> test/governance/extensions/GovernorSuperQuorumGreaterThanQuorum.t.sol && npx hardhat compile",
            "dependsOn": ["cold compile"]
          },
          "edit & compile Solidity contract: contracts/utils/math/Math.sol": {
            "command": "printf \"\\n// hardhat benchmark edit\\n\" >> contracts/utils/math/Math.sol && npx hardhat compile",
            "dependsOn": ["cold compile"]
          }
        }
      },
      "warm compile": {
        "runs": 2,
        "command": "npx hardhat compile",
        "dependsOn": ["cold compile"]
      },
      "test mocha": {
        "runs": 2,
        "command": "npx hardhat test mocha --no-compile",
        "dependsOn": ["cold compile"]
      }
    }
  }
}
