{
  "$schema": "../../scripts/end-to-end/schema/scenario.schema.json",
  "description": "1inch Network Fusion Atomic Swaps on Hardhat 3, using the dynamic imports plugin (@ignored/imports-plugin).",
  "tags": ["external-repo"],
  "repo": "1inch/cross-chain-swap",
  "commit": "68191c117c3a74917e823cbaeab31976463c12ef",
  "packageManager": "yarn",
  "submodules": false,
  "defaultCommand": "npx hardhat test solidity",
  "benchmark": {
    "commands": {
      "compile sequence": {
        "runs": 2,
        "steps": {
          "reset files & cache": {
            "command": "git checkout -- test/libraries/FeeCalcLib.t.sol test/integration/MerkleStorageInvalidator.t.sol contracts/libraries/TimelocksLib.sol && npx hardhat clean",
            "measure": false
          },
          "cold compile": {
            "command": "npx hardhat compile",
            "dependsOn": ["reset files & cache"]
          },
          "edit & compile Solidity test with min deps: test/libraries/FeeCalcLib.t.sol": {
            "command": "printf \"\\n// hardhat benchmark edit\\n\" >> test/libraries/FeeCalcLib.t.sol && npx hardhat compile",
            "dependsOn": ["cold compile"]
          },
          "edit & compile Solidity test with max deps: test/integration/MerkleStorageInvalidator.t.sol": {
            "command": "printf \"\\n// hardhat benchmark edit\\n\" >> test/integration/MerkleStorageInvalidator.t.sol && npx hardhat compile",
            "dependsOn": ["cold compile"]
          },
          "edit & compile Solidity contract: contracts/libraries/TimelocksLib.sol": {
            "command": "printf \"\\n// hardhat benchmark edit\\n\" >> contracts/libraries/TimelocksLib.sol && npx hardhat compile",
            "dependsOn": ["cold compile"]
          }
        }
      },
      "warm compile": {
        "runs": 2,
        "command": "npx hardhat compile",
        "dependsOn": ["cold compile"]
      },
      "test solidity": {
        "runs": 15,
        "command": "npx hardhat test solidity --no-compile",
        "dependsOn": ["cold compile"]
      },
      "test solidity -vvv": {
        "runs": 15,
        "command": "npx hardhat test solidity --no-compile -vvv",
        "dependsOn": ["cold compile"]
      },
      "test solidity -vvvv": {
        "runs": 15,
        "command": "npx hardhat test solidity --no-compile -vvvv",
        "dependsOn": ["cold compile"]
      }
    }
  }
}
